verse_id,english_text
09024001,Saul returned from fighting the Philistines . He declared : » I have heard that David is in the desert around En-Gedi . «
09024005,Later David’s conscience bothered him because he had cut off the edge of Saul’s robe .
09024011,"» My master , look at this ! The border of your robe is in my hand ! I cut off the border of your robe and did not kill you . You should know and be able to see I mean no harm or rebellion . I have not sinned against you ! But you are trying to ambush me in order to take my life ."
09024012,"» I will let Jehovah decide which one of us has done right . I pray that Jehovah will punish you for what you are doing to me . However , I will not do anything to you ."
09024018,» You have shown me how you were kind enough not to kill me when Jehovah gave you the chance .
09025007,» ‘ I hear that your sheepshearers are with you . Your shepherds have been with us . We have not mistreated them . Nothing of theirs has been missing as long as they have been in Carmel .
09025014,One of Nabal’s servants told Nabal’s wife Abigail : » Have you heard ? David sent some messengers from the wilderness with greetings for our master . He insulted them .
09025034,» I solemnly promise as Jehovah the God of Israel lives that if you had not come to meet me Nabal would not have had one of his men alive at dawn . «
09025035,Then David accepted what she brought him . He said : » Go home in peace . I have listened to what you said and I grant your request . «
09025037,In the morning after the effects of the wine wore off his wife told him what had happened . Nabal had a stroke . He could not move .
09025039,David heard Nabal was dead . He said : » Blessed is Jehovah who defended me against the insults of Nabal . He kept me from doing wrong . Jehovah has turned Nabal’s own wickedness back on him . « David sent men on his behalf to propose marriage to Abigail .
09026016,"» You failed in your duty , Abner ! I swear by the living God Jehovah all of you deserve to die . You have not protected your master , whom Jehovah made king . Look for the king’s spear ? Where is the water jar that was near his head ? «"
09026018,He also said : » Why are you my lord pursuing your servant ? What have I done ? Or what evil is in my hand ?
09026019,"» Please let my lord the king listen to the words of his servant . If Jehovah has stirred you up against me , let Him accept an offering . If it is men , cursed are they before Jehovah . They have driven me out today so that I would have no attachment with the inheritance of Jehovah , saying : ‘ Go serve other gods . ’ «"
09026021,"» My servant David , « Saul said , » I have sinned . Come back . I will not harm you again . You valued my life today . I have acted like a fool . I made a terrible mistake . «"
09028009,The woman answered : » You know what King Saul has done ? He forced the fortunetellers and mediums to leave Israel . Are you trying to trap me and get me killed ? «
09028012,"The woman saw Samuel . She screamed and said to Saul , » Why have you tricked me ? You are King Saul ! «"
09028015,Samuel said to Saul : » Why have you disturbed me ? Why did you make me come back ? « Saul answered : » I am in great trouble ! The Philistines are at war with me . God has abandoned me . He does not answer me any more by prophets or by dreams . Please tell me what to do . «
09028016,Samuel said : » Why do you call me when Jehovah has abandoned you and become your enemy ?
09028020,At once Saul fell down and lay stretched out on the ground . He was terrified by what Samuel said . He was weak because he had not eaten anything all day and all night .
09028024,The woman quickly butchered a calf she had fattened . Then she took some flour and prepared it . She baked some bread without yeast .
09029003,The Philistine commanders saw them and asked : » What are these Hebrews doing here ? « Achish answered : » This is David . He is the man who ran away from King Saul of Israel . He has been with me for more than a year . He has done nothing I can find fault with since the day he came to me . «
09029005,"» This is David , the one about whom the women sang , as they danced : Saul has killed thousands , but David has killed tens of thousands . «"
09029006,Achish called David and said : » I swear by the living God of Israel that you have been loyal to me . I would be pleased to have you go with me and fight in this battle . I have found no fault in you from the day you came to me . But the other kings do not approve of you .
09029008,"David answered : » What have I done wrong ? As you say , you have not found any fault in me since the day I started serving you . Why should I not go with you , my master and king , and fight your enemies ? «"
09030003,"When David and his men came to Zikleg they found it completely destroyed by fire . Their wives , sons , and daughters had been taken captive ."
09030012,"He also ate some dried figs , and two bunches of raisins . After he ate his strength returned . He had not eaten nor did he drank for three days ."
09030016,"He led David to the Amalekites . They were eating , drinking and celebrating because of what they had taken from Philistia and Judah ."
09030019,"Young and old , sons and daughters alike , no one was missing . David brought back everything that had been stolen ."
09030022,"Then every wicked and worthless man who had gone with David said : » Since they did not go with us , they should not be given any of the loot we recovered . Each of them should take only his wife and children and leave . «"
09030023,"David said : » My brothers , do not do that with the things Jehovah has given us . He kept us safe and helped us defeat the enemy ."
09030031,and Hebron . He sent it to all the places where he and his men had been .
09031007,The Israelites on the other side of Jezreel Valley and east of the Jordan River heard that the Israelite army had fled and that Saul and his sons had been killed . They abandoned their towns and fled . Then the Philistines came and occupied the towns .
09031011,The people living in Jabesh Gilead heard what the Philistines had done to Saul .
10001010,"» I went up to him and killed him . I knew that he would die anyway as soon as he fell . Then I took the crown from his head and the bracelet from his arm . Here , I have brought them to you . «"
10001012,"They grieved and mourned and fasted until evening for Saul and Jonathan and for Israel , the people of Jehovah , because so many had been killed in battle ."
10001016,David said to him : » Your blood is on your head . Your mouth has testified against you . For you admit that you killed Jehovah’s anointed . «
10001019,"» Your beauty , O Israel , is slain on your high places ! How the mighty have fallen !"
10001025,» The brave soldiers have fallen . They were killed in battle . Jonathan lies dead in the hills .
10001027,"» The mighty have fallen , their weapons abandoned and useless . «"
10002007,» Be strong and courageous . Your master Saul is dead . Therefore the tribe of Judah has anointed me to be their king . «
10002027,Joab said : » As God lives ; if you had not spoken the men would have continued following their brothers . «
10003008,"Ishbosheth’s question made Abner very angry . » Am I a dog that belongs to Judea ? « He asked . » Until now I have been faithful to your father Saul’s family , to his relatives and friends . I did not hand you over to David . But now you charge me with a crime because of this woman ."
10003019,Abner also spoke to the people of Benjamin . Then Abner went directly to David in Hebron . He told him everything Israel and the entire tribe of Benjamin had approved .
10003022,"Just then David’s men and Joab came home from a raid with a lot of plunder . Abner had been dismissed , so he was no longer with David in Hebron ."
10003024,Joab went to the king and asked : » What have you done ? Abner came to see you . Why did you send him away ?
10003027,"Abner arrived in Hebron . Joab took him aside at the gate , as though he wanted to speak privately with him . There he stabbed him in the stomach . So Abner was murdered because he had killed Joab’s brother Asahel ."
10003038,"The king told his officers : » Do you not know that today a leader , a great man , has fallen in Israel ?"
10004001,"Saul’s son Ishbosheth heard that Abner had died in Hebron . He lost his courage , and all Israel was alarmed ."
10004008,"They took the head of Ishbosheth to David at Hebron and said to the king , » Here is the head of Ishbosheth the son of Saul , your enemy , who sought your life . Jehovah has given my lord the king vengeance this day on Saul and his descendants . «"
10004010,» I once seized a man who told me that Saul had died . He thought he was bringing good news . I killed him in Ziklag to reward him for his news .
10004011,"» How much more should I reward wicked men who kill an innocent man on his own bed in his home ? Jehovah has rescued me from every trouble . I solemnly swear , as Jehovah lives , I will now seek revenge for his murder and rid the land of you . «"
10005012,David knew that Jehovah made him king of Israel and that he had made him a powerful ruler for the good of his people .
10005020,David went to Baal Perazim and defeated the Philistines . He said : » Jehovah has overwhelmed my enemies in front of me like an overwhelming flood . « That is why that place is called Baal Perazim Master of Breaking Through
10006008,Because of that the place has been called Perez Uzzah breakthrough of Uzzah ever since . David was furious because Jehovah punished Uzzah in anger .
10006012,King David was told : » Jehovah has blessed Obed Edom’s home and everything he owns because of the Ark of God . « Then David joyfully went to get the Ark of God from Obed Edom’s house and bring it to the City of David .
10007006,"» From the time I rescued the people of Israel from Egypt until now , I have never lived in a temple . I have traveled around living in a tent ."
10007007,» In all my traveling with the people of Israel I never asked any of the leaders that I appointed why they had not built me a temple made of cedar . ’ «
10007011,when I let judges rule my people . I have kept your enemies from attacking you . Now I promise that you and your descendants will be kings .
10007018,"David went into the tent he set up for the ark . Then he sat there and prayed : » Jehovah All-Powerful , my family and I do not deserve what you have already done for us ."
10007019,"» Yet this was insignificant in your eyes , O Sovereign Lord Jehovah for you have spoken also of your servant’s house in the distant future . And this is the law for man , O Sovereign Lord Jehovah ."
10007021,» For the sake of your Word and according to your will you have done this great thing . You have made it known to your servant !
10007022,"» For this reason you are great , O Sovereign Lord Jehovah . There is none like you . There is no God besides you according to all that we have heard with our ears ."
10007024,» You chose Israel to be your people from generation to generation ! You have become their God .
10007025,"» And now , Jehovah God , please do what you have promised ."
10007027,"» Now therefore , may it please you to bless the house of your servant that it may continue a long time before you . You O Lord Jehovah have spoken . May the house of your servant be blessed from generation to generation ."
10007028,"» Lord Jehovah , you are God . You have promised me some very good things , and you can be trusted to do what you promise ."
10007029,"» Please bless my descendants and let them be your chosen kings for a very long time . You have already promised , and I am sure that you will bless my family from generation to generation . «"
10008009,Soon King Toi of Hamath heard that David had defeated Hadadezer’s entire army .
10008010,"He sent his son Joram to greet King David and congratulate him for fighting and defeating Hadadezer . There had often been war between Hadadezer and Toi . Joram brought articles of gold , silver , and copper with him ."
10010005,David was told what happened . He sent someone to meet them because they were deeply humiliated . The king said to them : » Stay at Jericho until your beards have grown back . Then return to Jerusalem . «
10010006,"The Ammonites realized they had made themselves repulsive to David . They hired the Arameans from Beth Rehob and Zobah , with twenty thousand foot soldiers . From the army of the king of Maacah they hired one thousand men , and twelve thousand men of Tob ."
10010015,The Syrians knew they had been defeated by the Israelites . They called all their troops together .
10010019,"As soon as the kings who were subject to Hadadezer realized that they had been defeated by the Israelites , they made peace with them and became their subjects . The Syrians were afraid to help the Ammonites any more ."
10011004,So David sent messengers to get her . She came to him and they had sexual intercourse . She had just cleansed herself after her monthly period . Then she went home .
10011010,Someone told David that Uriah did not go home . So the next morning David asked him : » Why did you not go home ? Have you been away for a long time ? «
10012008,"» ‘ I gave you his kingdom and his wives . Then I made you king over Israel and Judah . If this had not been enough , I would have given you twice as much ."
10012009,» ‘ Why have you disobeyed my commands ? Why did you do this evil thing ? You had Uriah killed in battle ! You let the Ammonites kill him . Then you took his wife !
10012010,» ‘ In every generation some of your descendants will die a violent death because you have disobeyed me and have taken Uriah’s wife .
10012013,David said to Nathan : » I have sinned against Jehovah . « Nathan replied : » Jehovah has taken away your sin . You will not die .
10012014,» You have shown total contempt for Jehovah by this affair . Therefore the son that is born to you must die . «
10012015,Nathan went home . Jehovah struck the child that Uriah’s wife had given birth to David . The child became sick .
10013020,"Tamar’s brother Absalom said to her : » How could Amnon have done such a terrible thing to you ! But since he is your brother , do not tell anyone what happened . Just try not to think about it . « Tamar soon moved into Absalom’s house . She was always sad and lonely ."
10013030,"While they were on their way , David heard this rumor : » Absalom has killed all the king’s sons , and not a single one is left . «"
10013032,"Jonadab son of David’s brother Shimea , said : » Do not think that all the young men are dead . They have not killed all the king’s sons . Only Amnon is dead . Absalom decided to do this the day his half brother raped his sister Tamar ."
10013034,Absalom has fled . The servant keeping the watch looked outside . He saw many people coming down the road beside the mountain west of him .
10013039,King David longed for Absalom once people had consoled him over Amnon’s death .
10014002,Joab sent someone to Tekoa to get a wise woman from there . He told her : » Please act like a mourner . Dress in mourning clothes . Do not use any cosmetic lotions . Act like a woman who has been mourning for the dead for a long time .
10014007,"» All my relatives have turned against me and are demanding that I hand my son over to them . They want to kill him for murdering his brother . If they do this , I will be left without a son . They will destroy my last hope . They will leave my husband without a son to keep his name alive . «"
10014013,"The woman said : » Have you been hurting God’s people ? Your own son had to leave the country . When you judged in my favor , it was the same as admitting that you should have let him come back ."
10014017,» I can rest easy now that you have given your decision . You know the difference between right and wrong just like an angel of God . I pray that Jehovah your God will be with you . «
10014020,"» Your servant Joab has done this to view this matter from a different angle . You are as wise as an angel of God messenger of God , who knows everything on earth . «"
10014021,Later on the king said to Joab : » I have decided to do what you want . Go and get the young man Absalom and bring him back here . «
10014022,Joab quickly bowed down with his face touching the ground . He blessed the king . He said : » Today I know that you have been kind to me because you did what I wanted . «
10015018,"All his mercenaries passed by him . The Cherethites , all the Pelethites , Ittai , and all six hundred men who had followed him from Gath marched past the king ."
10016008,"» You took Saul’s kingdom . Now Jehovah is punishing you for murdering so many of Saul’s family . Jehovah has given the kingdom to your son Absalom . You are ruined , you bloodthirsty murderer ! «"
10016018,Hushai answered : » Jehovah and the people of Israel have chosen you to be king . I cannot leave . I must stay and serve the one they have chosen .
10016021,Ahithophel answered : » Some of your father’s wives were left here to take care of the palace . You should have sex with them . Then everyone will find out that you have publicly disgraced your father . This will make you and your followers even more powerful . «
10017008,» You know your father and his followers are mighty warriors . They are as fierce as a mother bear whose cubs have just been killed . Your father has a lot of experience in fighting wars . He will not spend the night with the others .
10017009,"» He has no doubt already found a hiding place in a cave or somewhere else . When people hear that some of your soldiers have been killed , everyone will think your entire army has been destroyed ."
10017022,So David and his men crossed the Jordan . By daybreak they had all gone across .
10017023,Ahithophel saw that his advice had not been followed . He saddled his donkey and went back to his hometown . He arranged his affairs in order and he hanged himself . He was buried in the family grave .
10018011,» What ! You saw what ? « Joab said . » Why did you not strike him to the ground ? Then I would have felt obligated to give you four ounces of silver and a belt . «
10018013,» Would you have stood by me if I did something treacherous to him ? There is nothing hidden from the king . You would turn against me . «
10018021,Someone from Ethiopia was standing there . Joab told him : » Go tell the king what you have seen . « The man knelt down in front of Joab and then got up and started running .
10018022,"Ahimaaz spoke to Joab again : » No matter what happens , I still want to run . The Ethiopian has already left . « Joab said : » Why should you run ? You will not get a reward for the news you have ! «"
10018028,"Ahimaaz approached the king , greeted him , and bowed down in front of him . Ahimaaz said : » May Jehovah your God be praised . He has handed over the men who rebelled against Your Majesty . «"
10018033,"The king was shaken by the news . He went to the room above the gate and cried . » My son Absalom ! « He said . » My son , my son Absalom ! I wish I had died in your place ! Absalom , my son , my son ! «"
10019005,Joab went to the house where David was staying and told him : » You have made your soldiers ashamed ! They saved your life and the lives of your sons and daughters and wives as well .
10019007,"» Now stand up ! Go out there and thank them for what they did . If you do not , I swear by Jehovah you will not even have one man left on your side tomorrow morning . You may have had a lot of troubles in the past . But this will be the worst thing that has ever happened to you ! «"
10019009,All the people in all the tribes of Israel argued with one another . They said : » The king rescued us from our enemies and saved us from the Philistines . Now he has fled from Absalom and left the country .
10019010,"» Absalom , whom we anointed to rule us , has died in battle . Why is no one talking about reinstating the king ? «"
10019020,» I know I was wrong and have sinned . That is why I wanted to be the first one from the northern tribes to meet you . «
10019022,"David exclaimed : » Abishai , what will I do with you and your brother Joab ? Is it your job to tell me who has done wrong ? I have been made king of all Israel today . No one will be put to death ! «"
10019028,» You could have killed anyone in my entire family . Instead you seated me with those who eat at your table . I no longer have the right to complain to my lord the king . «
10019030,"» Let him take it all , « Mephibosheth told the king . » It is enough for me that you have come home safely . «"
10020013,"After the body had been removed from the road , everyone followed Joab in pursuit of Sheba ."
10020021,"» That is not so . A man from the mountains of Ephraim by the name of Sheba son of Bichri has rebelled against King David . Give him to me and I will withdraw from the city . « The woman told Joab : » Watch , for his head will be thrown to you from the wall . «"
10021012,"David took the bones of Saul and his son Jonathan from the citizens of Jabesh Gilead . They had stolen them from the public square of Beth Shean , where the Philistines hung them the day they killed Saul at Gilboa ."
10021013,David brought the bones of Saul and Jonathan . His men also gathered the bones of those who had been executed .
10022005,» The waves of death had surrounded me . The torrents of destruction had overwhelmed me .
10022022,» I have kept the ways of Jehovah . I have not wickedly turned away from my God .
10022023,» All your judgments are in front of me . I have not turned away from your laws .
10022024,» You know I am faultless . I have kept myself from doing wrong .
10022036,» O Jehovah you protect me and save me . Your help has made me grow great multiply .
10023003,"» The God of Israel has spoken . The protector of Israel said to me : ‘ The king who rules with justice , who rules in obedience to God ."
10023011,"Next in rank to him was Shammah , the son of Agee from Harar . The Philistines had gathered at Lehi , where there was a field of ripe lentils . When the troops fled from the Philistines ,"
10024015,"So Jehovah sent a plague among the Israelites from that morning until the time he had chosen . Of the people from Dan to Beersheba , seventy thousand died ."
10024017,David saw the angel who had been killing the people . He said to Jehovah : » I have sinned . I have done wrong . What have these sheep done ? Please let your punishment be against me and against my father’s family . «
10024019,David obeyed Jehovah’s command and went as Gad had told him to .
11001006,His father never confronted him by asking : » Why have you done this ? «
11001007,"But Adonijah had discussed his actions with Joab son of Zeruiah and with the priest Abiathar , so they supported him ."
11001011,"Then Nathan asked Solomon's mother Bathsheba : » Have you heard that Adonijah , Haggith's son , has become king , and our master David does not even know about it ?"
11001013,"» ‘ Go now to King David and ask him : ‘ Your Majesty , did you solemnly promise me that my son Solomon would succeed you as king ? How is it that Adonijah has become king ? ’"
11001018,» Adonijah has already become king . You do not know anything about it .
11001019,"» He has offered a sacrifice of many bulls , sheep , and fattened calves . He invited your sons , and Abiathar the priest , and Joab the commander of your army to the feast . However he did not invite your son Solomon ."
11001025,"» This very day he has gone and offered a sacrifice of many bulls , sheep , and fattened calves . He invited all your sons , Joab the commander of your army , and Abiathar the priest , and right now they are feasting with him and shouting : ‘ Long live King Adonijah ! ’"
11001029,"Then he said to her : » I promise you by the living God Jehovah , who has rescued me from all my troubles ,"
11001035,» Follow him back here when he comes to sit on my throne . He will succeed me as king . He is the one I have chosen to be the ruler over Israel and Judah . «
11001037,» Jehovah has been with Your Majesty . May he also be with Solomon and make his reign even more prosperous than yours . «
11001039,"Zadok took the container of olive oil that he had brought from the Tent of Jehovah’s presence , and anointed Solomon . They blew the trumpet , and all the people shouted : » Long live King Solomon ! «"
11001043,"» Not at all , « Jonathan answered Adonijah . » His Majesty King David has made Solomon king ! «"
11001047,"» Even the royal officials have come to congratulate His Majesty King David , saying : May your God make Solomon's name more famous than yours and his reign greater than your reign . The king himself bowed down on his bed"
11002005,"» Remember what Joab did to me by killing the two commanders of Israel's armies , Abner son of Ner and Amasa son of Jether . You remember how he murdered them in time of peace . This was revenge for deaths they had caused in time of war . He killed innocent men . I bear the responsibility for what he did . I suffer the consequences ."
11002015,He said : » You know the kingship was mine . All Israel expected me to be their king . But the kingship has been turned over to my brother because Jehovah gave it to him .
11002024,» Now by the living God Jehovah who has given me my throne from David my father . He made me one of a line of kings . He gave me his word . Adonijah will be put to death this day . «
