verse_id,english_text
19074018,"Remember this , that the enemy has mocked you , Jehovah . Foolish people have blasphemed your name ."
19075003,The earth and all who dwell in it dissolve melt become faint hearted . I have firmly set its pillars .
19077005,"I have considered the days of old , the years of ancient times ."
19077009,"Has God forgotten to be gracious ? Has he , in anger , withheld his compassion ?"
19077014,You are the God who does wonders . You have made your strength known among the peoples .
19077015,"You have redeemed your people with your arm , the sons of Jacob and Joseph ."
19078003,That we have heard and known and our fathers have told us .
19078004,"We will not conceal them from their children , but tell to the generation to come the praises of Jehovah , and his strength and his wondrous works that he has done ."
19078011,They forgot his deeds and his miracles that he had shown them .
19078030,"Before they had satisfied their desire , while their food was in their mouths ,"
19078054,"He brought them into his holy land , to this mountain that his power had won ."
19078060,"He abandoned his dwelling place in Shiloh , the tent where he had lived among humans ."
19078065,"Jehovah woke up like one who had been sleeping , like a warrior sobering up from too much wine ."
19079001,"O God , the nations have invaded the land that belongs to you . They have dishonored defiled your holy temple . They have left Jerusalem in ruins ."
19079002,They have given the dead bodies of your servants to the birds for food . They have given the flesh of your godly ones to the animals .
19079003,They have shed the blood of your people around Jerusalem as though it were water . There is no one to bury your people .
19079004,"We have become a disgrace to our neighbors , an object of ridicule and contempt to those around us ."
19079006,"Pour your fury anger on the nations that do not know you , on the kingdoms that have not called you ."
19079007,They have devoured Jacob . They have destroyed his home .
19080016,The vine has been cut down and burned . Let them be destroyed by the threatening look on your face .
19080017,"Let your power rest on the man you have chosen , the son of man you strengthened for yourself ."
19083002,"For , behold , your enemies are stirred up . Those who hate you have lifted up their heads ."
19083005,For they have come to an agreement united in thought . They form an alliance against you .
19083008,Assyria also is joined with them . They have helped the children of Lot .
19084003,"Even small birds have built a nest , and the swallows have their own home . They keep their young near your altars O Jehovah my king and my God ."
19085010,Mercy and truth have met . Righteousness and peace have kissed .
19086009,"All the nations that you have made will bow in your presence , Jehovah . They will honor glorify you ."
19086013,Your loving kindness toward me is great . You have rescued me from the depths of the grave .
19086017,"Grant me some proof of your goodness so that those who hate me may see it and be put to shame . You , O Jehovah , have helped me and comforted me ."
19088005,"I am abandoned with the dead , like those who have been killed and lie in graves . I am like those whom you no longer remember , who are cut off from your hand power care ."
19088006,"You have put me in the bottom of the pit , in deep dark places ."
19088008,"You have taken my friends far away from me . You made me disgusting to them . I am shut in , and I cannot get out ."
19088015,"Ever since I was young , I have been suffering and near death . I have endured your terrors , and now I am in despair ."
19088016,Your burning anger has swept over me . Your terrors have destroyed me .
19088018,You have taken my loved ones and friends far away from me . Darkness is my only friend !
19089002,For I have said : » Loving-kindness will be built up forever . You will establish your faithfulness in the heavens . «
19089011,The heavens and the earth are yours . You have founded the world and all it contains .
19089012,"The north and the south , you have created them ; Tabor and Hermon shout for joy at your name ."
19089019,Once you spoke in vision to your godly ones . You said : » I have given help to one who is mighty . I have exalted one chosen from the people . «
19089020,I have found David my servant . I anointed him with my holy oil .
19089035,On my holiness I have taken an oath : I will not lie to David .
19089038,"But you have despised , rejected , and become angry with your anointed one ."
19089039,You have refused to recognize the covenant to your servant and have thrown his crown into the dirt .
19089040,You have broken through all his walls and have laid his fortified cities in ruins .
19089041,Everyone who passed by robbed him . He has become the object of his neighbors' scorn .
19089047,Remember how short my life span is ! Have you created the sons of men for no reason ?
19089050,"Jehovah , remember the reproach of your servant . Remember how I have carried in my heart the insults from so many people ."
19090001,"O Jehovah , you have been our refuge throughout every generation ."
19090015,"Make us rejoice for as many days as you have made us suffer , for as many years as we have experienced evil ."
19091009,"» You , O Jehovah , are my refuge ! « You have made the Most High your home ."
19092004,"You made me find joy in what you have done , O Jehovah . I will sing joyfully about the works of your hands ."
19092010,But you exalt my horn make me as strong as a wild bull . I have been anointed with soothing lotion .
19093001,"Jehovah reigns and he is clothed with majesty . Jehovah has girded himself with strength . The world also is established , that it cannot be moved ."
19093003,"The floods have lifted up , O Jehovah , the floods have lifted up their voice ; the floods lift up their pounding waves ."
19094017,"If Jehovah had not been my help , I would have been silent in death ."
19094018,"If I should say : My foot has slipped , your loving kindness , O Jehovah , will hold me up ."
19094022,Jehovah has become my stronghold . My God has become my rock of refuge .
19094023,He has turned their wickedness against them . He will destroy them because of their sins . Jehovah our God will destroy them .
19095010,"For forty years I was grieved with this generation . I said : » It is a people who go astray in their hearts , and they have not known my ways . «"
19098001,Sing a new song to Jehovah for he has done miraculous things . His right hand and his holy arm have gained victory for him .
19098002,Jehovah has made his salvation known . He has uncovered his righteousness for the nations to see .
19098003,He remembered his loving kindness and faithfulness to Israel's descendants . All the ends of the earth have seen how our God saves them .
19099004,The strength of the King loves justice . You have established equity . You have executed justice and righteousness in Jacob .
19100003,"Know that Jehovah is God . He has made us , and not we ourselves . We are his people , and the sheep of his pasture ."
19102003,"My days have been consumed in smoke , and my bones have been scorched like a hearth ."
19102004,My heart has been stricken like grass and has withered away . In fact I forget to eat my bread .
19102006,I resemble a pelican of the wilderness . I have become like an owl of the waste places .
19102007,"I lie awake , I have become like a lonely bird on a housetop ."
19102008,All day long my enemies have reproached me . Those who deride me used my name as a curse .
19102009,For I have eaten ashes like bread and mingled my drink with weeping .
19102010,This is because of your indignation and your anger . You have lifted me up and cast me away .
19102013,You will arise and have compassion on Zion . It is time to be gracious to her for the appointed time has come .
19102016,For Jehovah has built up Zion . He has appeared in His glory .
19102017,He has respected the prayer of the destitute and has not despised their prayer .
19102023,He has weakened my strength in the way and has shortened my days .
19103002,With all my heart I praise Jehovah ! Do not forget how kind he has been .
19103010,He has not dealt with us according to our sins . He has not requited us according to our iniquities .
19103012,"As far as the east is from the west , so far has he removed our transgressions from us . as far as the sunrise is from the sunset farther then one could ever travel"
19103019,Jehovah has prepared his throne in the heavens . His kingdom rules over all .
19104024,"O Jehovah , how many are your works ! In wisdom you have made them all . The earth is full of your possessions ."
19105005,"Remember the marvelous works that he has done , his wonders , and the judgments of his mouth ."
19105008,He has remembered his covenant forever ! It is the word he commanded to a thousand generations .
19105026,"He sent his servant Moses , and he sent Aaron , whom he had chosen ."
19105044,He gave them the lands of other nations . They inherited what others had worked for .
19106006,We have sinned like our fathers ! We have committed iniquity and have behaved wickedly .
19106034,They did not destroy the people as Jehovah had told them .
19107002,"Let the redeemed by Jehovah say so , whom he has redeemed from the hand of the adversary ,"
19107011,They had rebelled against God's words and had despised the advice given by the Most High .
19107022,Let them bring songs of thanksgiving as their sacrifice . Let them tell in joyful songs what he has done .
19107024,"have seen what Jehovah can do , the miracles he performed in the depths of the sea ."
19107030,The sailors were glad that the storm was quiet . He guided them to the harbor they had longed for .
19108007,"God has spoken in his holiness : I will rejoice , I will divide Shechem , and mete out the valley of Succoth ."
19109002,Wicked and deceitful people have opened their mouths against me . They speak against me with lying tongues .
19109011,Let a creditor take everything he owns . Let strangers steal what he has worked for .
19109023,I fade away like a lengthening shadow . I have been shaken off like a grasshopper .
19109024,"My knees give way because I have been fasting . My body has become lean , without any fat ."
19109025,I have become the victim of my enemies' insults . They look at me and shake their heads .
19110004,Jehovah has taken an oath and will not change his mind : » You are a priest forever in the order of Melchizedek . «
19111004,He has made his miracles unforgettable . Jehovah is gracious and compassionate .
19111006,He has revealed the power of his works to his people by giving them the lands of other nations as an inheritance .
19111009,He has sent deliverance to his people . He has ordered that his covenant should continue forever . His name is holy and awesome .
19115016,"The highest heaven belongs to Jehovah , but he has given the earth to the sons of men ."
19116007,I will be at peace again because Jehovah has been good to you .
19116012,How can I repay Jehovah for all the good that he has done for me ?
19116016,"O Jehovah , I am indeed your servant . I am your servant , the son of your handmaid . You have freed me from my chains ."
19118014,Jehovah makes me powerful and strong ; he has saved me .
19118015,Listen to the glad shouts of victory in the tents of God's people : Jehovah’s mighty power has done it !
19118016,"His power has brought us victory , his mighty power in battle !"
19118018,"Jehovah has punished me severely , but he has not let me die ."
19118021,"I praise you , Jehovah , because you heard me , because you have become my salvation ."
19118024,This is the day Jehovah has made let us rejoice and be glad in it !
19118026,Blessed is he who comes in the name of Jehovah ! We have blessed you from the house of Jehovah .
19118027,Jehovah is God and he has given us light . Bind the festival sacrifice with cords to the horns of the altar .
19119004,You have ordained your precepts that we should keep them diligently .
19119010,With all my heart I have sought you . Do not let me wander from your commandments .
19119011,Your word I have treasured in my heart that I may not sin against you .
19119013,With my lips I have told of all the ordinances of your mouth .
19119014,"I have rejoiced in the way of your written word , as much as in all riches ."
19119022,"Take away reproach and shame from me , for I have obeyed your laws ."
19119026,"I have told of my ways , and you have answered me . Teach me your statutes ."
19119030,I have chosen the faithful way ! I have placed your ordinances before me .
19119049,"Remember the word to your servant , in which you have made me hope ."
19119050,This is my comfort in my affliction : That your word has revived me .
19119052,"I have remembered your ordinances from of old , O Jehovah , and comfort myself ."
19119056,"This has become mine , that I observe your precepts ."
19119057,Jehovah is my portion ; I have promised to keep your words .
19119061,The cords of the wicked have encircled me . But I have not forgotten your law .
19119065,"You have dealt well with your servant , O Jehovah , according to your word ."
19119069,The arrogant have forged a lie against me . With all my heart I will observe your precepts .
19119075,"I know , O Jehovah , that your judgments are righteous , and that in faithfulness you have afflicted me ."
19119083,"Though I have become like a wineskin in the smoke , I do not forget your statutes ."
19119085,The arrogant have dug pits for me . They are not in agreement with your law .
19119086,All your commandments are faithful . They have persecuted me with a lie ; help me !
19119088,"Revive me according to your loving kindness , so I may keep the law of your mouth you have spoken ."
19119092,If your law had not been my delight I would have perished in my affliction .
19119093,I will never forget your precepts . By them you have revived me .
19119094,"I am yours , save me for I have sought your precepts ."
19119096,I have seen a limit to all perfection . Your commandment is exceedingly broad .
19119100,"I understand more than the aged , since I have observed your precepts ."
19119101,"I have restrained my feet from every evil way , that I may keep your word ."
19119102,I have not turned aside from your ordinances just as you have instructed me .
19119106,I have sworn and I will confirm it : I will keep your righteous ordinances .
19119110,"The wicked have laid a snare for me , yet I have not gone astray from your precepts ."
19119111,"I have inherited your laws forever , for they are the joy of my heart ."
19119112,"I have inclined my heart to perform your statutes forever , to the end ."
19119118,You have rejected all those who wander from your statutes . This is because their deceitfulness is useless .
19119119,You have removed all the wicked of the earth like dross ; Therefore I love your law .
19119121,I have done justice and righteousness . Do not leave me to my oppressors .
19119126,It is time for Jehovah to act . They have broken your law .
19119138,You have commanded your laws in righteousness and in exceeding faithfulness .
19119139,"My zeal has consumed me , for the reason that my adversaries have forgotten your words ."
19119143,Trouble and anguish have come upon me . Even so I am fond of your commandments .
19119152,Of old I have known from your laws that you have founded them forever .
19119173,Let Your hand be ready to help me . For I have chosen your precepts .
19119176,I have gone astray like a lost sheep . Look for your servant for I have not forgotten your commandments .
19120006,I have lived too long with those who hate peace .
19124003,"» Then they would have swallowed us up quickly , when their wrath was kindled against us ."
19124004,"» Then the waters would have overwhelmed us , yes the stream would have gone over us ."
19124006,"» Blessed is Jehovah , who has not given us as a prey to their teeth ."
19124007,"» We escaped as a bird out of the trap of fowlers bird catchers . The trap is broken , and we have escaped ."
19126002,Then our mouths were filled with laughter and our tongues with joyful songs . Then the nations said : » Jehovah has done spectacular things for them . «
19126003,Jehovah has done spectacular things for us . We are overjoyed .
19127005,Blessed is the man who has filled his quiver with them . He will not be put to shame when he speaks with his enemies in the city gate .
19128002,You will certainly eat what your own hands have provided . Blessings to you ! May things go well for you !
19129001,"» Many times they have persecuted me from my youth up , « Let Israel now say :"
19129002,» Many times they have persecuted me from my youth up . Yet they have not prevailed against me .
19129004,» Jehovah is righteous . He has cut to pieces the cords of the wicked .
19130001,"Out of the depths of despair I have cried to you , O Jehovah ."
19132006,"Now , we have heard about the Ark of the Covenant being in Ephrathah . We found it in Jaar ."
19132013,Jehovah has chosen Zion . He wants it for his home .
19135004,For Jehovah has chosen Jacob for Himself and Israel for his special treasure property .
19136024,"He has rescued us from our adversaries , for his loving kindness is everlasting ."
19137003,It was there that those who had captured us demanded that we sing . Those who guarded us wanted us to entertain them . They said : » Sing a song from Zion for us ! «
19138002,I will bow toward your holy temple . I will praise your name because of your loving kindness and truth . You have made your name and your covenant greater than everything .
19138004,"All the kings of the earth will praise you , O Jehovah , because they have heard the words you spoke ."
19138008,"Jehovah will do everything for me . O Jehovah , your mercy endures forever . Do not let go of what your hands have made ."
19139001,"O Jehovah , you have searched me and you know me ."
19139005,"You have enclosed me behind and before , and laid your hand upon me ."
19139016,Your eyes saw my embryo and all were written in your book ; the days ordained for me . Even this before one had taken place .
19139022,I hate them with the utmost hatred ! They have become my enemies .
19140005,Arrogant people have laid a trap for me . They have spread out a net with ropes . They have set traps for me along the road .
19140007,"O Lord Jehovah Almighty , the strong one who saves me , you have covered my head in the day of battle ."
19141008,"My eyes look to you , O Jehovah . I have taken refuge in you . Do not leave me defenseless ."
19142003,"When I begin to lose hope , you already know what I am experiencing . My enemies have hidden a trap for me on the path where I walk ."
19143003,"For the enemy has persecuted me . He has crushed my life to the ground . He has made me dwell in dark places , like those who have long been dead ."
19147020,He has done nothing like this for any other nation . The other nations do not know the decisions he has handed down . Praise Jehovah !
19148014,"He has given his people a strong leader , someone praiseworthy for his faithful ones , for the people of Israel , the people who are close to him . Praise Jehovah !"
20001025,» You have ignored all my counsel . You accept no correction .
20001031,» Now you will get what you deserve for what you have done . Your own advice will make you sick .
20003030,Argue with no one if they have never done you any harm .
20004016,They do not sleep unless they have done evil . Their sleep is taken away unless they make someone fall .
20005012,You say : » How I have hated instruction ! My heart despised reproof .
20007026,She has wounded many . Many strong men have been slain by her .
20008026,» He had not made the earth or the fields or the highest part of the dust of the world .
20009005,"» Come eat my bread , and drink the wine that I have mixed ."
20020009,Who can say : » I have made my heart clean . I am pure from my sin ? «
20021031,"The horse has prepared the day of battle . However , deliverance is from Jehovah ."
20022020,Have I not written to you excellent things in counsel and knowledge ?
20022028,Do not remove the ancient landmark which your fathers have set .
20024029,Do not say : » I will do to him as he has done to me . I will render to the man according to his work . «
20025007,"Better that he says : » Come up here than you be put down in the presence of the prince , whom your eyes have seen . «"
20025016,Have you found honey ? Eat only what is needed or you will be too full and vomit .
20030020,"Such is the way of an adulterous woman . She eats and wipes her mouth , and says : » I have done no wickedness . «"
20031029,"Many daughters have done well , but you are above them all ."
21001009,That which has been is that which will be . That which has been done is that which will be done . There is nothing new under the sun !
21001010,"Is there anything of which it may be said : » See , this is new ? « It has already existed in days of old , which were before us ."
21001013,I devoted myself to study and explored wisdom concerning all that is done under the heavens . It is a grievous task God has given to the sons of men to be afflicted with .
21001014,"I have seen all the works that are done under the sun . Behold , all is vanity and a striving after wind ."
21001016,"I said to my heart , » I have become great and have aquired more wisdom than all who were before me in Jerusalem . Yes , my heart has seen an abundance of wisdom and knowledge . «"
21002009,I became great and increased more than all who had been before me in Jerusalem and my wisdom remained with me .
21002011,I looked at all the works my hands accomplished . I saw everything I had worked to do . I saw that all was vanity and grasping for the wind . It was to no purpose for there was no profit under the sun .
21002012,I went again in search of wisdom and of foolish ways . What can the man do that comes after the king ? Only what he has already done .
21002015,"Then I said in my heart : » As it happens to the fool , so it will happen to me . Why have I been so wise ? « Then I said in my heart : » This also is vanity . «"
21002018,"I hated all the work I had done under the sun , because I would leave it behind for the man who comes after me ."
21002019,Who knows if he will be a wise man or a fool ? But he will have power over all the work that I have done and in which I have been wise under the sun . This too is vanity .
21002020,My heart turned to grief over all for which I had labored and all my wisdom under the sun .
21002021,"Because there is a man whose work has been done with wisdom , with knowledge , and with an expert hand . But one who has done nothing for it will have it for his heritage . This also is vanity and a great evil ."
21002022,"What does a man get for all his work , and for the desire of his heart with which he has done his work under the sun ?"
21003010,I have seen the task that God has given with which the sons of men are occupied .
21003015,That which is has already been and that which is to be has already been . God seeks what has passed by .
21004003,"Better off then both of them is the one who has not ever been , who has not seen the evil work that is done under the sun ."
21004004,I have learned why people work so hard to succeed . It is because they envy the things their neighbors have . But it is vanity ! It is like chasing the wind .
21004016,"There is no end of all the people , even of all that have been before them . Those who come later will not rejoice in him . Surely this also is vanity and grasping for the wind ."
21005013,I have seen a grievous evil under the sun . I have seen riches being hoarded by their owner to his downfall distress .
21005018,This is what I have seen . It is good and fitting for one to eat and drink and enjoy the good of his labor . He labors under the sun all the days of his life . For God gives this to him as his allotment inheritance .
21005019,"For every man to whom God has given riches and wealth , He has empowered him to eat because of them . He should receive his reward and rejoice in his labor . This is the gift of God ."
21006001,There is an evil that I have seen under the sun and it is prevalent among men .
21006002,"God has given man riches , wealth and honor , so that he lacks nothing of all that he desires . Yet God has not empowered him to partake of them for a foreigner enjoys them . This is vanity and a severe affliction ."
21006005,» Moreover he has not seen the sun nor known anything . The stillborn child has more rest than the other .
21006006,"» Even though he lives a thousand years twice over , yet he has seen no good . Do not all go to one place ? «"
21007013,Consider the work of God . Who can make straight what he has made crooked ?
21007015,"I have seen all things in the days of my vanity . There is a just man who perished in his righteousness , and there is a wicked man who prolonged his life in his wickedness ."
21007022,Often your own heart knows you have also cursed others .
21007023,I have tried and proved all this by wisdom . I said : » I will be wise « but it was far from me .
21007027,"» Behold , this I have found , « says the preacher , » counting one by one to find out the account : «"
21007028,For I am still seeking and have not found . One man among a thousand I have found ; but a woman among all those I have not found .
21007029,"» You see ! I have found only this , that God made man upright . But they have sought out many devices schemes reasonings . «"
21008009,I have seen all this and applied my heart to every work that is done under the sun . There is a time when one man rules over another to his own misery and harm .
